{
  "acceptance": {
    "active_execution_authority_preserved": true,
    "all_runs_succeeded": true,
    "candidate_only": true,
    "zero_external_services": true
  },
  "environment": {
    "external_services": 0,
    "machine": "x86_64",
    "platform": "Linux",
    "python_implementation": "CPython",
    "python_version": "3.14.6"
  },
  "measurement": {
    "events_per_run": 1,
    "ideas_per_run": 1,
    "max_total_ms": 5.771648,
    "p50_total_ms": 3.382357,
    "p95_total_ms": 4.321488,
    "samples": 1000,
    "successful_runs": 1000
  },
  "observed_at": "2026-08-14T08:30:00+08:00",
  "provenance": {
    "benchmark_schema_sha256": "8064674d0efcac479c2ef2f86d78d8b650b3a71875022a11ccf4956d8a410d33",
    "benchmark_sha256": "b1659376b595ae6ead23429edd377a35408eeb58e4986e56d27c168033bd0864",
    "idea_capture_schema_sha256": "57ce195183a8534df1cb075c8d8f8a343545aeba31af30b64fc5bf01e1cf56ca",
    "idea_event_schema_sha256": "7207bf6406bc3827f9eb14b10ed41d1679aebe28802fc1e95c38d83f65ced3c7",
    "implementation_sha256": "186f8caa929e80f6d1afda24f8b073e7fd967c6a87323a2f0046f1c8fa868a91",
    "registry_sha256": "68ff56b0225cb8c3d673e87b3bbc8dc844ecb2bf25a79805b1183703cddd8aae",
    "runner_sha256": "1b0f71b2e50014cb31cdc33d8aec4597fb2569d4da42b014654e265cea34544d",
    "sqlite_state_store_sha256": "bc80a19b025170dce595489cb06c8f1872f7b1d156447a2615f8b13be5dc2fc7",
    "state_events_sha256": "b99078df3a3ad1d74a54debf764980372f097db63bc8579c04fa6b6bde889483",
    "state_mcp_sha256": "1e2a6519c54a46492bb4d5000a615a1d44e5bccacbda3c31eba5f59adef55ad2",
    "typed_state_sha256": "9151f130c9cbe426e5c8e55fd1f2c42bad5d5c093254a67cfa5ee7e16b9447c4"
  },
  "schema_version": "context.idea-continuity-benchmark/v1alpha1"
}
